{
  "schema_version": 1,
  "memory_id": "MEM-eric-decision-style-001",
  "type": "semantic",
  "title": "Eric 决策风格:具体推荐+备选+风险",
  "content": "Eric 偏好具体推荐 + 备选方案 + 风险说明;不喜欢纯菜单或'看你/都行'式回避;接受两段式/渐进式落地;偏保守但能拍板;跨阶段倾向先修依赖再上层。",
  "tags": [
    "user-preference",
    "decision-style",
    "conservative-with-decisiveness"
  ],
  "source_conversation_id": null,
  "source_decision_id": null,
  "source_run_id": null,
  "scope": "user",
  "expires_at": null,
  "pinned": true,
  "confidence": 0.95,
  "created_at": "2026-07-31T08:00:00.000Z",
  "updated_at": null
}
